{
	"contractVersion": 1,
	"mapId": "civic-building-directory-v1",
	"width": 1000,
	"height": 620,
	"originX": 0,
	"originY": 0,
	"cellSize": 20,
	"columns": 50,
	"rows": 31,
	"reviewStatus": "confirmed",
	"walkableRuns": [
		[2, 22, 27],
		[3, 22, 27],
		[4, 22, 27],
		[5, 22, 27],
		[6, 22, 27],
		[7, 22, 27],
		[8, 22, 27],
		[9, 22, 27],
		[10, 22, 27],
		[11, 22, 27],
		[12, 5, 45],
		[13, 5, 45],
		[14, 5, 45],
		[15, 5, 45],
		[16, 5, 45],
		[17, 5, 45],
		[18, 5, 45],
		[19, 5, 45],
		[20, 22, 27],
		[21, 22, 27],
		[22, 22, 27],
		[23, 22, 27],
		[24, 22, 27],
		[25, 22, 27],
		[26, 22, 27],
		[27, 22, 27]
	]
}
